{
  "schema_version": "m1.v0.1",
  "request_id": "req-02",
  "task_id": "task-02",
  "base_version": 4,
  "control": {
    "max_questions": 2,
    "remaining_rounds": 0,
    "allow_questions": false,
    "context_coverage": "complete",
    "current_date": "2026-09-22"
  },
  "state": {
    "selected_category": "coding",
    "requirements": [
      {
        "item_id": "r1",
        "field": "goal",
        "text": "制作活动报名网站。",
        "kind": "user_decision",
        "strength": "unspecified",
        "scope": "报名网站",
        "source_refs": [
          {
            "source_id": "u1",
            "quote": "活动报名网站"
          }
        ],
        "depends_on": [],
        "confirmation": "confirmed"
      },
      {
        "item_id": "r2",
        "field": "constraints",
        "text": "本次不做付款。",
        "kind": "user_decision",
        "strength": "hard",
        "scope": "报名网站",
        "source_refs": [
          {
            "source_id": "u1",
            "quote": "本次不做付款"
          }
        ],
        "depends_on": [],
        "confirmation": "confirmed"
      },
      {
        "item_id": "r3",
        "field": "use_context",
        "text": "用于课堂演示。",
        "kind": "user_fact",
        "strength": "unspecified",
        "scope": "报名网站",
        "source_refs": [
          {
            "source_id": "u1",
            "quote": "用于课堂演示"
          }
        ],
        "depends_on": [],
        "confirmation": "confirmed"
      },
      {
        "item_id": "r4",
        "field": "deliverable",
        "text": "活动报名网站。",
        "kind": "user_decision",
        "strength": "unspecified",
        "scope": "报名网站",
        "source_refs": [
          {
            "source_id": "u1",
            "quote": "活动报名网站"
          }
        ],
        "depends_on": [],
        "confirmation": "confirmed"
      }
    ],
    "gaps": [],
    "question_history": [],
    "open_conflicts": []
  },
  "sources": [
    {
      "source_id": "u1",
      "role": "user",
      "text": "做一个用于课堂演示的活动报名网站，本次不做付款。"
    },
    {
      "source_id": "u2",
      "role": "user",
      "text": "还是加上在线付款吧。"
    }
  ],
  "current_source_id": "u2",
  "category_config": {
    "version": "categories.proposed.v0.1",
    "common_fields": [
      "goal",
      "audience",
      "context",
      "materials",
      "constraints",
      "deliverable",
      "success_criteria",
      "preferences",
      "other"
    ],
    "category_fields": {
      "writing": [
        "purpose",
        "length",
        "evidence_policy",
        "style"
      ],
      "presentation": [
        "duration",
        "slide_count",
        "core_message",
        "structure"
      ],
      "learning": [
        "baseline",
        "learning_goal",
        "available_time",
        "practice"
      ],
      "planning_research": [
        "decision_purpose",
        "scope_boundary",
        "resources",
        "evidence_policy"
      ],
      "data_analysis": [
        "analysis_question",
        "data_schema",
        "metric_definition",
        "chart_use",
        "analysis_scope"
      ],
      "coding": [
        "use_context",
        "features",
        "runtime",
        "existing_code",
        "io_behavior"
      ],
      "general": []
    }
  }
}
